headline,image,url
Graphic Truth: The Trump effect on Canada’s US-bound exports,image_8.jpg,"https://www.gzeromedia.com/media-library/image.png?id=61111064&width=1200&height=448&quality=85&coordinates=0,249,0,250"
Graphic Truth: Over 60 ridings flip as Liberals retain power,image_9.jpg,"https://www.gzeromedia.com/media-library/map-of-electoral-shifts-in-canada.png?id=60068488&width=1200&height=448&quality=85&coordinates=0,228,0,229"
Graphic Truth: Canada is winning the real wage war,image_10.jpg,"https://www.gzeromedia.com/media-library/line-graphs-comparing-inflation-to-wages-in-the-us-and-canada.png?id=59865898&width=1200&height=448&quality=85&coordinates=0,228,0,229"
Exclusive Echelon/GZERO poll: What would Americans annex?,image_11.jpg,"https://www.gzeromedia.com/media-library/image.png?id=56122627&width=1200&height=448&quality=85&coordinates=0,248,0,249"
Battle of the bots: Trump trial,image_12.jpg,"https://www.gzeromedia.com/media-library/cyabra-data-of-trump-trial.png?id=52476570&width=1200&height=448&quality=85&coordinates=0,7,0,423"
Battle of the bots: AOC under attack,image_13.jpg,"https://www.gzeromedia.com/media-library/graph-of-real-and-fake-account-activity-on-aoc-s-x-account.png?id=52420971&width=1200&height=448&quality=85&coordinates=0,0,0,430"
Battle of the Bots: Violence at the DNC,image_14.jpg,"https://www.gzeromedia.com/media-library/analysis-of-new-and-fake-responses-to-the-dncs-x-post-announcing-the-2024-convention.png?id=52373420&width=1200&height=448&quality=85&coordinates=0,447,0,447"
Bots battle Bibi,image_15.jpg,"https://www.gzeromedia.com/media-library/infographic-of-fake-and-real-accounts-that-interacted-with-a-post-from-israel-s-prime-minister.png?id=52360369&width=1200&height=448&quality=85&coordinates=0,26,0,404"
Graphic Truth: A world thirsty for peace,image_16.jpg,"https://www.gzeromedia.com/media-library/image.png?id=51808242&width=1200&height=448&quality=85&coordinates=0,220,0,221"
The Graphic Truth: Black representation in the US Congress,image_17.jpg,"https://www.gzeromedia.com/media-library/image.png?id=51222209&width=1200&height=448&quality=85&coordinates=0,211,0,212"
The Graphic Truth: UN personnel in peril,image_18.jpg,"https://www.gzeromedia.com/media-library/image.png?id=50416658&width=1200&height=448&quality=85&coordinates=0,175,0,176"
The Graphic Truth: The NHL is no longer dominated by Canadians,image_19.jpg,"https://www.gzeromedia.com/media-library/image.png?id=49468103&width=1200&height=448&quality=85&coordinates=0,258,0,259"
The Graphic Truth: Spanish political gridlock,image_20.jpg,"https://www.gzeromedia.com/media-library/mock-chamber-chart-showing-seats-held-by-each-party-in-the-spanish-parliament.png?id=34659826&width=1200&height=448&quality=85&coordinates=0,231,0,232"
The Graphic Truth: What Oppenheimer worried about,image_21.jpg,"https://www.gzeromedia.com/media-library/box-chart-showing-number-of-nuclear-weapons-by-country.png?id=34639959&width=1200&height=448&quality=85&coordinates=0,270,0,271"
The Graphic Truth: How NATO absorbed its old foes,image_22.jpg,"https://www.gzeromedia.com/media-library/image.gif?id=34309441&width=1200&height=448&quality=85&coordinates=0,212,0,213"
The Graphic Truth: Canada rolls out the welcome mat,image_23.jpg,"https://www.gzeromedia.com/media-library/image.png?id=34293810&width=1200&height=448&quality=85&coordinates=0,228,0,229"
The Graphic Truth: The EU from its origins until now,image_24.jpg,"https://www.gzeromedia.com/media-library/image.png?id=34230353&width=1200&height=448&quality=85&coordinates=0,228,0,229"
The Graphic Truth: Canadian lumber production ... in the US,image_25.jpg,"https://www.gzeromedia.com/media-library/a-bar-graph-of-the-increase-in-canada-s-investment-in-the-us-lumber-industry.png?id=34002576&width=1200&height=448&quality=85&coordinates=0,191,0,192"
The Graphic Truth: Indian Railways spending blitz,image_26.jpg,"https://www.gzeromedia.com/media-library/a-graph-comparing-the-indian-government-s-spending-on-the-national-railway-system-and-key-train-accidents-since-2001.png?id=33993783&width=1200&height=448&quality=85&coordinates=0,191,0,192"
The Graphic Truth: US-China: Cold War or Cold Cash?,image_27.jpg,"https://www.gzeromedia.com/media-library/line-chart-showing-china-s-goods-trade-with-the-us-eu-and-japan.png?id=33790566&width=1200&height=448&quality=85&coordinates=0,280,0,281"
"Graphic Truth: The US Border Before, During, and After Title 42",image_28.jpg,"https://www.gzeromedia.com/media-library/graphic-of-migration-statistics-and-demographics-at-the-us-southern-border.png?id=33673049&width=1200&height=448&quality=85&coordinates=0,677,0,677"
The Graphic Truth: God Save Canada,image_29.jpg,"https://www.gzeromedia.com/media-library/infographic-of-polling-on-canadian-news-about-the-british-monarchy.png?id=33599766&width=1200&height=448&quality=85&coordinates=0,514,0,0"
The Graphic Truth: Taiwan's shrinking recognition,image_30.jpg,"https://www.gzeromedia.com/media-library/comparative-maps-showing-which-countries-had-official-diplomatic-ties-with-taiwan-just-before-the-un-recognized-the-people-s-rep.gif?id=33297797&width=1200&height=448&quality=85&coordinates=0,89,0,89"
The Graphic Truth: Female governance gap,image_31.jpg,"https://www.gzeromedia.com/media-library/image.png?id=36557048&width=1200&height=448&quality=85&coordinates=0,228,0,229"
The Graphic Truth: How much it costs to supply Ukraine,image_32.jpg,"https://www.gzeromedia.com/media-library/total-spending-on-military-aid-to-ukraine-by-top-contributors-as-a-percentage-of-their-respective-defense-budgets.png?id=33110734&width=1200&height=448&quality=85&coordinates=0,225,0,226"
The Graphic Truth: Russia vs. US trade ties in Africa,image_33.jpg,"https://www.gzeromedia.com/media-library/bilateral-trade-with-russia-compared-to-us-by-african-countries-that-abstained-in-recent-un-vote-to-condemn-ukraine-war.png?id=33097044&width=1200&height=448&quality=85&coordinates=0,264,0,265"
The Graphic Truth: The US-Russia nuclear race,image_34.jpg,"https://www.gzeromedia.com/media-library/image.png?id=33077893&width=1200&height=448&quality=85&coordinates=0,192,0,193"
The Graphic Truth: Who's making enough babies?,image_35.jpg,"https://www.gzeromedia.com/media-library/graph-showing-global-fertility-rates-and-life-expectancies.png?id=32892416&width=1200&height=448&quality=85&coordinates=0,264,0,265"
The Graphic Truth: World not yet fully back to work,image_36.jpg,"https://www.gzeromedia.com/media-library/bar-charts-showing-change-in-number-of-hours-worked-before-and-after-pandemic-in-select-global-regions-and-income-groups.png?id=32108691&width=1200&height=448&quality=85&coordinates=0,229,0,230"
The Graphic Truth: Will US voters show up?,image_37.jpg,"https://www.gzeromedia.com/media-library/will-us-voters-show-up.png?id=32052306&width=1200&height=448&quality=85&coordinates=0,118,0,484"
The Graphic Truth: Don't bet on it,image_38.jpg,"https://www.gzeromedia.com/media-library/chart-comparing-chances-of-democrats-keeping-the-senate-in-the-us-midterms-given-by-election-forecasting-site-based-on-polls-and.png?id=32019863&width=1200&height=448&quality=85&coordinates=0,187,0,188"
The Graphic Truth: The world needs less cash,image_39.jpg,"https://www.gzeromedia.com/media-library/line-chart-comparing-non-cash-transactions-volume-in-5-global-regions-from-2019-to-2023.gif?id=31946494&width=1200&height=448&quality=85&coordinates=0,258,0,259"
The Graphic Truth: The digital payment boom,image_40.jpg,"https://www.gzeromedia.com/media-library/a-graphic-of-digital-payment-volumes-around-the-world.png?id=31879446&width=1200&height=448&quality=85&coordinates=0,192,0,193"
The Graphic Truth: The strong greenback,image_41.jpg,"https://www.gzeromedia.com/media-library/graphic-truth-the-us-dollar-is-strong-though-the-russian-ruble-has-risen-in-value-more-in-2022-through-the-end-of-september.png?id=31856909&width=1200&height=448&quality=85&coordinates=0,238,0,239"
The Graphic Truth: Sending money home,image_42.jpg,"https://www.gzeromedia.com/media-library/top-10-countries-remittances-are-sent-from-and-sent-to-the-10-countries-most-dependent-on-remittances-and-how-many-billions-a.png?id=31848721&width=1200&height=448&quality=85&coordinates=0,262,0,263"
The Graphic Truth: Natural gas prices make EU power costs soar,image_43.jpg,"https://www.gzeromedia.com/media-library/the-graphic-truth-natural-gas-prices-make-eu-power-costs-soar.png?id=31535625&width=1200&height=448&quality=85&coordinates=0,222,0,223"
The Graphic Truth — WAR! Who is it good for?,image_44.jpg,"https://www.gzeromedia.com/media-library/the-graphic-truth-war-who-is-it-good-for.png?id=31206382&width=1200&height=448&quality=85&coordinates=0,539,0,539"
The Graphic Truth: Opium keeps the Taliban going,image_45.jpg,"https://www.gzeromedia.com/media-library/the-graphic-truth-opium-keeps-the-taliban-going.png?id=30872435&width=1200&height=448&quality=85&coordinates=0,199,0,200"
The Graphic Truth: Upcoming 2022 elections,image_46.jpg,"https://www.gzeromedia.com/media-library/the-graphic-truth-upcoming-2022-elections.png?id=30069491&width=1200&height=448&quality=85&coordinates=0,208,0,208"
The Graphic Truth: Tourists trickle back into the US,image_47.jpg,"https://www.gzeromedia.com/media-library/the-graphic-truth-tourists-tricked-back-into-the-us.png?id=30051631&width=1200&height=448&quality=85&coordinates=0,262,0,262"
The Graphic Truth: Gasping at the pump – global gas prices soar,image_48.jpg,"https://www.gzeromedia.com/media-library/gasping-at-the-pump-global-gas-prices-soar.png?id=30023174&width=1200&height=448&quality=85&coordinates=0,348,0,348"
The Graphic Truth: Worlds apart on LGBTQ rights,image_49.jpg,"https://www.gzeromedia.com/media-library/worlds-apart-on-lgbtq-rights-the-global-landscape-of-rights-for-same-sex-couples-infographic.png?id=29965141&width=1200&height=448&quality=85&coordinates=0,476,0,476"
The Graphic Truth: US flushes LatAm with cash,image_50.jpg,"https://www.gzeromedia.com/media-library/us-flushes-latam-with-cash.png?id=29958714&width=1200&height=448&quality=85&coordinates=0,286,0,286"
The Graphic Truth: Boris hangs on by a thread,image_51.jpg,"https://www.gzeromedia.com/media-library/the-graphic-truth-boris-hangs-on-by-a-thread.png?id=29943819&width=1200&height=448&quality=85&coordinates=0,380,0,380"
The Graphic Truth: Americans googling the economy,image_52.jpg,"https://www.gzeromedia.com/media-library/americans-googling-the-economy.png?id=29938691&width=1200&height=448&quality=85&coordinates=0,237,0,237"
The Graphic Truth: Who bought the most Russian oil?,image_53.jpg,"https://www.gzeromedia.com/media-library/who-bought-the-most-russian-oil.png?id=29929745&width=1200&height=448&quality=85&coordinates=0,237,0,237"
The Graphic Truth: How edible oil prices are cooking,image_54.jpg,"https://www.gzeromedia.com/media-library/the-graphic-truth-how-edible-oil-prices-are-cooking.png?id=29874090&width=1200&height=448&quality=85&coordinates=0,216,0,216"
The Graphic Truth: Carb prices on the rise,image_55.jpg,"https://www.gzeromedia.com/media-library/carb-prices-on-the-rise.png?id=29841634&width=1200&height=448&quality=85&coordinates=0,253,0,253"
The Graphic Truth: Has clean water access improved?,image_56.jpg,"https://www.gzeromedia.com/media-library/has-clean-water-access-improved-percent-of-population-with-access-to-safe-drinking-water-based-on-accessiblity-and-quality-cha.png?id=29833357&width=1200&height=448&quality=85&coordinates=0,253,0,253"
The Graphic Truth: Abortion laws around the world,image_57.jpg,"https://www.gzeromedia.com/media-library/image.png?id=36569692&width=1200&height=448&quality=85&coordinates=0,253,0,254"
The Graphic Truth: Twitter doesn't rule the social world,image_58.jpg,"https://www.gzeromedia.com/media-library/the-graphic-truth-twitter-doesn-t-rule-the-social-world.png?id=29750896&width=1200&height=448&quality=85&coordinates=0,245,0,245"
The Graphic Truth: Americans sour on economy,image_59.jpg,"https://www.gzeromedia.com/media-library/image.png?id=29714165&width=1200&height=448&quality=85&coordinates=0,270,0,270"
The Graphic Truth: What do Europeans think of their economy?,image_60.jpg,"https://www.gzeromedia.com/media-library/what-do-europeans-think-of-their-economy.png?id=29714141&width=1200&height=448&quality=85&coordinates=0,264,0,264"
The Graphic Truth: Kicking the Russian gas habit,image_61.jpg,"https://www.gzeromedia.com/media-library/image.png?id=29640749&width=1200&height=448&quality=85&coordinates=0,265,0,265"
The Graphic Truth: Women are still underrepresented,image_62.jpg,"https://www.gzeromedia.com/media-library/image.png?id=29620930&width=1200&height=448&quality=85&coordinates=0,218,0,218"
The Graphic Truth: North Korea's missile menu,image_63.jpg,"https://www.gzeromedia.com/media-library/the-graphic-truth-north-korea-s-missile-menu.png?id=29601378&width=1200&height=448&quality=85&coordinates=0,135,0,135"
The Graphic Truth: What does Roman Abramovich own?,image_64.jpg,"https://www.gzeromedia.com/media-library/the-graphic-truth-what-does-roman-abramovich-own.png?id=29585441&width=1200&height=448&quality=85&coordinates=0,489,0,489"
The Graphic Truth: Where Ukrainian refugees are going,image_65.jpg,"https://www.gzeromedia.com/media-library/the-graphic-truth-where-ukrainian-refugees-are-going.png?id=29572016&width=1200&height=448&quality=85&coordinates=0,185,0,185"
The Graphic Truth: Major corporate withdrawals from Russia,image_66.jpg,"https://www.gzeromedia.com/media-library/the-graphic-truth-major-corporate-withdrawals-from-russia.png?id=29518005&width=1200&height=448&quality=85&coordinates=0,270,0,270"
The Graphic Truth: Who's nuclear in the EU?,image_67.jpg,"https://www.gzeromedia.com/media-library/the-graphic-truth-who-s-nuclear-in-the-eu.png?id=29488090&width=1200&height=448&quality=85&coordinates=0,169,0,169"
The Graphic Truth: Hotspots for digital nomads,image_68.jpg,"https://www.gzeromedia.com/media-library/hotspots-for-digital-nomads.png?id=29480430&width=1200&height=448&quality=85&coordinates=0,169,0,169"
The Graphic Truth: Nuclear weapons — who has what?,image_69.jpg,"https://www.gzeromedia.com/media-library/the-graphic-truth-nuclear-weapons-who-has-what.png?id=29461865&width=1200&height=448&quality=85&coordinates=0,270,0,270"
The Graphic Truth: Ukraine war hits ruble hard,image_70.jpg,"https://www.gzeromedia.com/media-library/ukraine-war-hits-ruble-hard.png?id=29445995&width=1200&height=448&quality=85&coordinates=0,228,0,228"
The Graphic Truth: European reliance on Russian gas,image_71.jpg,"https://www.gzeromedia.com/media-library/the-graphic-truth-european-reliance-on-russian-gas.png?id=29405675&width=1200&height=448&quality=85&coordinates=0,581,0,582"
The Graphic Truth: Black immigrants in the US,image_72.jpg,"https://www.gzeromedia.com/media-library/black-immigrants-in-the-u-s.png?id=29329002&width=1200&height=448&quality=85&coordinates=0,240,0,240"
The Graphic Truth: China-Russia trade ties,image_73.jpg,"https://www.gzeromedia.com/media-library/china-russia-trade-ties.png?id=29284761&width=1200&height=448&quality=85&coordinates=0,231,0,231"
The Graphic Truth: US and China not making enough babies,image_74.jpg,"https://www.gzeromedia.com/media-library/us-and-china-not-making-enough-babies-population-growth-in-the-us-and-china-1961-2020-of-population.png?id=29216350&width=1200&height=448&quality=85&coordinates=0,228,0,228"
The Graphic Truth: Two narrowing pandemics – EU vs US,image_75.jpg,"https://www.gzeromedia.com/media-library/two-narrowing-pandemics-eu-vs-us-seven-day-rolling-average-of-new-coronavirus-deaths-1-jan-2021-to-6-jan-2022.png?id=28770291&width=1200&height=448&quality=85&coordinates=0,182,0,182"
The Graphic Truth: Is the US-China trade war over?,image_76.jpg,"https://www.gzeromedia.com/media-library/the-graphic-truth-is-the-us-china-trade-war-over.png?id=28715664&width=1200&height=448&quality=85&coordinates=0,208,0,208"
The Graphic Truth: Omicron dominates America,image_77.jpg,"https://www.gzeromedia.com/media-library/the-graphic-truth-omicron-dominates-america.png?id=28271839&width=1200&height=448&quality=85&coordinates=0,308,0,308"
The Graphic Truth: Now arriving in NYC,image_78.jpg,"https://www.gzeromedia.com/media-library/nyc-tourist-arrivals-top-10-countries-of-origin-and-average-spending-per-tourist.png?id=27940467&width=1200&height=448&quality=85&coordinates=0,195,0,195"
The Graphic Truth: COVID deaths falling in leading countries,image_79.jpg,"https://www.gzeromedia.com/media-library/new-weekly-covid-deaths-in-the-five-countries-with-highest-overall-death-toll-1-march-2020-3-november-2021.png?id=27925970&width=1200&height=448&quality=85&coordinates=0,241,0,241"
The Graphic Truth: US presidents' midterm pain,image_80.jpg,"https://www.gzeromedia.com/media-library/the-graphic-truth-us-presidents-midterm-pain-presidential-approval-ratings-after-one-year-in-us-history.png?id=27903944&width=1200&height=448&quality=85&coordinates=0,174,0,174"
The Graphic Truth: Will US kids get their toys on time?,image_81.jpg,"https://www.gzeromedia.com/media-library/the-graphic-truth-will-us-kids-get-their-toys-on-time.png?id=27712283&width=1200&height=448&quality=85&coordinates=0,226,0,226"
The Graphic Truth: China's growing share of the world economy,image_82.jpg,"https://www.gzeromedia.com/media-library/china-s-growing-share-of-the-world-economy.png?id=27699767&width=1200&height=448&quality=85&coordinates=0,201,0,201"
The Graphic Truth: 50 years of US inflation vs interest rates,image_83.jpg,"https://www.gzeromedia.com/media-library/the-graphic-truth-50-years-of-us-inflation-vs-interest-rates.png?id=27667111&width=1200&height=448&quality=85&coordinates=0,187,0,187"
The Graphic Truth: Is Biden's honeymoon period over?,image_84.jpg,"https://www.gzeromedia.com/media-library/image.png?id=27463937&width=1200&height=448&quality=85&coordinates=0,226,0,226"
The Graphic Truth: Who hosts the most Afghan refugees?,image_85.jpg,"https://www.gzeromedia.com/media-library/countries-that-hosted-the-highest-number-of-afghan-refugees-in-2020-millions-of-refugees.png?id=27272646&width=1200&height=448&quality=85&coordinates=0,199,0,199"
The Graphic Truth: Who controls Afghanistan?,image_86.jpg,"https://www.gzeromedia.com/media-library/image.png?id=27165214&width=1200&height=448&quality=85&coordinates=0,215,0,215"
The Graphic Truth: Life is actually getting better,image_87.jpg,"https://www.gzeromedia.com/media-library/the-graphic-truth-life-is-actually-getting-better.png?id=27085041&width=1200&height=448&quality=85&coordinates=0,276,0,276"
The Graphic Truth: Vax skepticism vs COVID deaths,image_88.jpg,"https://www.gzeromedia.com/media-library/vax-skepticism-vs-covid-deaths.png?id=27078739&width=1200&height=448&quality=85&coordinates=0,256,0,256"
The Graphic Truth: Where are climate-linked scorchers deadliest?,image_89.jpg,"https://www.gzeromedia.com/media-library/the-graphic-truth-where-are-climate-linked-scorchers-deadliest.png?id=26855954&width=1200&height=448&quality=85&coordinates=0,234,0,234"
The Graphic Truth: Did the war on drugs work?,image_90.jpg,"https://www.gzeromedia.com/media-library/image.png?id=26788880&width=1200&height=448&quality=85&coordinates=0,217,0,217"
The Graphic Truth: Who's spending what NATO wants?,image_91.jpg,"https://www.gzeromedia.com/media-library/image.png?id=26711639&width=1200&height=448&quality=85&coordinates=0,253,0,253"
The Graphic Truth: China makes a move in Central America,image_92.jpg,"https://www.gzeromedia.com/media-library/image.png?id=26421521&width=1200&height=448&quality=85&coordinates=0,187,0,187"
The Graphic Truth: China's social media spin blitz,image_93.jpg,"https://www.gzeromedia.com/media-library/the-graphic-truth-china-s-social-media-spin-blitz.png?id=26380122&width=1200&height=448&quality=85&coordinates=0,225,0,225"
"The Graphic Truth: COVID's ""real"" death toll",image_94.jpg,"https://www.gzeromedia.com/media-library/the-graphic-truth-covid-s-real-death-toll.png?id=26149262&width=1200&height=448&quality=85&coordinates=0,213,0,213"
The Graphic Truth: How many refugees does the US let in?,image_95.jpg,"https://www.gzeromedia.com/media-library/image.png?id=26136483&width=1200&height=448&quality=85&coordinates=0,266,0,266"
The Graphic Truth: Is Modi immune to the COVID crisis?,image_96.jpg,"https://www.gzeromedia.com/media-library/image.png?id=26101397&width=1200&height=448&quality=85&coordinates=0,223,0,223"
The Graphic Truth: Crypto-mining sucks up lots of power,image_97.jpg,"https://www.gzeromedia.com/media-library/image.png?id=26071732&width=1200&height=448&quality=85&coordinates=0,197,0,197"
The Graphic Truth: Two different pandemics - EU vs US,image_98.jpg,"https://www.gzeromedia.com/media-library/a-graphic-illustrating-how-the-effect-of-the-coronavirus-pandemic-in-the-us-and-the-eu.png?id=25840698&width=1200&height=448&quality=85&coordinates=0,184,0,184"
The Graphic Truth: Can we work only 4 days a week?,image_99.jpg,"https://www.gzeromedia.com/media-library/the-graphic-truth-can-we-work-only-4-days-a-week.png?id=25835294&width=1200&height=448&quality=85&coordinates=0,199,0,199"
"The Graphic Truth: COVID hurts democracy, no matter response",image_100.jpg,"https://www.gzeromedia.com/media-library/the-graphic-truth-covid-hurts-democracy-no-matter-response.png?id=25635593&width=1200&height=448&quality=85&coordinates=0,496,0,496"
The Graphic Truth: Who fits in China?,image_101.jpg,"https://www.gzeromedia.com/media-library/the-graphic-truth-who-fits-in-china-chinese-provinces-shown-as-a-country-of-similar-population-size.png?id=25542774&width=1200&height=448&quality=85&coordinates=0,244,0,244"
The Graphic Truth: The unequal road to herd immunity,image_102.jpg,"https://www.gzeromedia.com/media-library/the-unequal-road-to-herd-immunity.png?id=25449982&width=1200&height=448&quality=85&coordinates=0,287,0,287"
ANARCHY! How the world covered the insurrection in DC,image_103.jpg,"https://www.gzeromedia.com/media-library/collage-by-ari-winkleman.jpg?id=25266377&width=1200&height=448&quality=85&coordinates=0,111,0,0"
The Graphic Truth: Two different pandemics - EU vs US,image_104.jpg,"https://www.gzeromedia.com/media-library/image.png?id=24911361&width=1200&height=448&quality=85&coordinates=0,184,0,184"
The Graphic Truth: Who's buying up the COVID vaccines?,image_105.jpg,"https://www.gzeromedia.com/media-library/image.png?id=24863359&width=1200&height=448&quality=85&coordinates=0,322,0,322"
The Graphic Truth: Two different pandemics - EU vs US,image_106.jpg,"https://www.gzeromedia.com/media-library/image.png?id=24801257&width=1200&height=448&quality=85&coordinates=0,184,0,184"
The Graphic Truth: Asia's mega trade deals — RCEP vs TPP,image_107.jpg,"https://www.gzeromedia.com/media-library/image.png?id=24785757&width=1200&height=448&quality=85&coordinates=0,193,0,193"
The Graphic Truth: US election disputes — 2000 vs 2020,image_108.jpg,"https://www.gzeromedia.com/media-library/image.png?id=24771805&width=1200&height=448&quality=85&coordinates=0,376,0,376"
The Graphic Truth: The COVID vaccine race,image_109.jpg,"https://www.gzeromedia.com/media-library/image.png?id=24764122&width=1200&height=448&quality=85&coordinates=0,508,0,508"
The Graphic Truth: Two different pandemics - EU vs US,image_110.jpg,"https://www.gzeromedia.com/media-library/image.png?id=24654324&width=1200&height=448&quality=85&coordinates=0,184,0,184"
The Graphic Truth: Americans' growing mistrust of elections,image_111.jpg,"https://www.gzeromedia.com/media-library/graphic-by-ari-winkleman.png?id=24629922&width=1200&height=448&quality=85&coordinates=0,177,0,177"
The Graphic Truth: Early turnout in US battleground states,image_112.jpg,"https://www.gzeromedia.com/media-library/image.png?id=24604685&width=1200&height=448&quality=85&coordinates=0,205,0,205"
The Graphic Truth: Two different pandemics - EU vs US,image_113.jpg,"https://www.gzeromedia.com/media-library/image.png?id=24599778&width=1200&height=448&quality=85&coordinates=0,184,0,184"
The Graphic Truth: Urbanization around the world,image_114.jpg,"https://www.gzeromedia.com/media-library/graphic-by-ari-winkleman.png?id=24584013&width=1200&height=448&quality=85&coordinates=0,314,0,314"
The Graphic Truth: Trump's polling gap 2016 vs 2020,image_115.jpg,"https://www.gzeromedia.com/media-library/image.png?id=24554968&width=1200&height=448&quality=85&coordinates=0,266,0,266"
The Graphic Truth: Two different pandemics - EU vs US,image_116.jpg,"https://www.gzeromedia.com/media-library/image.png?id=24521105&width=1200&height=448&quality=85&coordinates=0,184,0,184"
The Graphic Truth: Two different pandemics - EU vs US,image_117.jpg,"https://www.gzeromedia.com/media-library/image.png?id=24455384&width=1200&height=448&quality=85&coordinates=0,184,0,184"
The Graphic Truth: Where are new COVID cases rising?,image_118.jpg,"https://www.gzeromedia.com/media-library/image.png?id=24448172&width=1200&height=448&quality=85&coordinates=0,605,0,606"
The Graphic Truth: New digital jobs in a post-pandemic world,image_119.jpg,"https://www.gzeromedia.com/media-library/image.png?id=24426509&width=1200&height=448&quality=85&coordinates=0,230,0,230"
The Graphic Truth: Who's been hit hardest by COVID job losses?,image_120.jpg,"https://www.gzeromedia.com/media-library/image.png?id=24329740&width=1200&height=448&quality=85&coordinates=0,192,0,192"
The Graphic Truth: EU populist parties weather COVID storm,image_121.jpg,"https://www.gzeromedia.com/media-library/eu-populist-parties-weather-covid-storm.png?id=24243655&width=1200&height=448&quality=85&coordinates=0,218,0,218"
The Graphic Truth: Racial diversity in US professional sports,image_122.jpg,"https://www.gzeromedia.com/media-library/image.png?id=23601313&width=1200&height=448&quality=85&coordinates=0,218,0,218"
